<!DOCTYPE model SYSTEM "../meta-cp.dtd">
<model version="0.1">  
    <sets>
        <set id="N" tex="\mathbb{N}" description="Natural numbers"></set>
        <set id="Zp" tex="\mathbb{Z}_p" description="Integers modulo p"></set>
    </sets>
  
    <customfunctions>
        <function id="exp" arity="2" notation="corner-ne" hint="group-exponentiation">
            <argset set="Zp"></argset>
            <argset set="N"></argset>
            <argset set="Zp"></argset>
        </function>
        <function id="g" hint="group-exponentiation">
            <argset set="Zp"></argset>
        </function>
        <function id="p">
            <argset set="N"></argset>
        </function>
        <function id="eq" arity="2" tex="=" notation="infix" hint="equality">
            <argset set="Zp"></argset>
            <argset set="Zp"></argset>
        </function>
    </customfunctions>
  
    <declarations>
        <declaration variable="x"  entity="A" set="N"></declaration>
        <declaration variable="y"  entity="B" set="N"></declaration>
        <declaration variable="kA" entity="A" set="Zp" tex="k_A" label="k"></declaration>
        <declaration variable="kB" entity="B" set="Zp" tex="k_B" label="k"></declaration>
        <declaration variable="gx" entity="A" set="Zp" tex="X"></declaration>
        <declaration variable="gy" entity="B" set="Zp" tex="Y"></declaration>
    </declarations>
  
    <protocol name="Diffie-Hellman key exchange">
        <description>Exchange a long term secret key</description>
    
        <entity id="A" name="A" desc="Alice">
        </entity>
        <entity id="B" name="B" desc="Bob">
        </entity>
    
        <message id="m-1" from="A" to="B">
            <knowledge entity="A">
                <variable id="g" type="constant"></variable>
            </knowledge>
            <knowledge entity="B">
                <variable id="g" type="constant"></variable>
            </knowledge>
            <pre>
                <assignment variable="x" type="probabilistic"></assignment>
                <assignment variable="gx">
                    <application function="exp">
                        <argument id="g" type="constant"></argument>
                        <argument id="x" type="nonce"></argument>
                    </application>
                </assignment>
            </pre>
            <event type="send">
                <variable id="gx"></variable>
            </event>
            <channel security="insecure"></channel>
            <event type="receive">
                <variable id="gx"></variable>
            </event>
            <post></post>
            <comment>send public key to other party</comment>
        </message>
    
        <message id="m-2" from="B" to="A">
            <knowledge entity="A">
                <variable id="g" type="constant"></variable>
                <variable id="x" type="nonce"></variable>
                <variable id="gx"></variable>
            </knowledge>
            <knowledge entity="B">
                <variable id="g" type="constant"></variable>
                <variable id="gx"></variable>
            </knowledge>
            <pre>
                <assignment variable="y" type="probabilistic"></assignment>
                <assignment variable="gy">
                    <application function="exp">
                        <argument id="g" type="constant"></argument>
                        <argument id="y" type="nonce"></argument>
                    </application>
                </assignment>
            </pre>
            <event type="send">
                <variable id="gy"></variable>
            </event>
            <channel security="insecure"></channel>
            <event type="receive">
                <variable id="gy"></variable>
            </event>
            <post></post>
            <comment>send public key to other party</comment>
        </message>
    
        <finalise entity="A" lastmessage="m-2">
            <assignment variable="kA">
                <application function="exp">
                    <argument id="gy"></argument>
                    <argument id="x" type="nonce"></argument>
                </application>
            </assignment>
        </finalise>
    
        <finalise entity="B" lastmessage="m-2">
            <assignment variable="kB">
                <application function="exp">
                    <argument id="gx"></argument>
                    <argument id="y" type="nonce"></argument>
                </application>
            </assignment>
        </finalise>
    
        <properties>
            <securityparameter id="n">512</securityparameter>
            <correctness>
                <application function="eq">
                    <argument id="kA"></argument>
                    <argument id="kB"></argument>
                </application>
            </correctness>
            <authentication integrity="A" towards="B"></authentication>
            <authentication integrity="B" towards="A"></authentication>
            <confidentiality>
                <secret variable="k">
                    <allowed entity="A"></allowed>
                    <allowed entity="B"></allowed>
                </secret>
            </confidentiality>
        </properties>
    </protocol>
</model>
